{
  "benchmark": "entity-resolution-ambiguity-v1",
  "bindings": {
    "activation_sha256": "d418c4d21865f50c7a1d949777d22dca793eb51a79965bfa941017f892f2f2ea",
    "authorization_sha256": "30890b1ac027caf4c3175e6c602581ad3c9e544d932435bff045884b795e5728",
    "bridge_design_sha256": "2d4875b94cf7467f591201436c6fbd9eab19e879282c4d03d7500720699c5afe",
    "command_descriptor_sha256": "817d3e1eae8babb26eb49792b5778898793235042020c9f904cad0057e8549ac",
    "controller_binding_attestation_sha256": "f11beabbbd55b9f36ab924fcd767e985eee3e218d70a5520047997b4e3cb6f57",
    "controller_sha256": "2b9e0026ed756468432c8d07edca9ebc49ef3b727defbc39f3b55cb9319d9661",
    "execution_protocol_sha256": "5d44ee19992fdd71a25c19ca0bb9f276ba07ea809f016068d6db6cb338610fe7",
    "governed_main": "834c2dba2a56930c7fd595d648b02eb1dd83dfc1",
    "hard_disabled_bridge": {
      "immutable": true,
      "merged_main": "834c2dba2a56930c7fd595d648b02eb1dd83dfc1",
      "path": "suites/entity-resolution-ambiguity-v1/execution_bridge.py",
      "reviewed_head": "9876b0ba906d40c400bb6f63dfb8a810b1379241",
      "sha256": "f0aaa7706f92d99ee80f152a199b2e8f31dd12cf0c6494c8733e51a962b807be",
      "verifier_sha256": "6585aa8e09b58925027882d0dfed62fc5412deba3f3d9c5a311c051576f3d491"
    },
    "permit_sha256": "7cef4548b571940a2fe34e3a4025afe8fe632a90c4af38b9fbd00b1b5794a8d3",
    "portable_plan_sha256": "df1fbeab0a2c89c16fb9530aaf4f5545d62a4dab3f44f160dacdc231a3463ac7",
    "process_launcher_sha256": "d8d028d95adb463f27b5df6a5ec44ae9049b6799aae46c4b0176ca2adfd07f90",
    "runtime_policy_sha256": "0ae9913e36bc3109ea36f7da93219852760a8f347bc5d802aaacde313ddefced"
  },
  "corpus_contract": {
    "concrete_corpus_root_bound_at_design_time": false,
    "concrete_corpus_root_must_be_hash_verified_before_run": true,
    "files": {
      "manifest.json": "27c5e7bcd3d3f75f87b095cedd4c996bf02575299c1ed1412eec9571676e3708",
      "test.csv": "6e98690c2ee302bc16f7deda59a3e332e872f076925d0380c926d8f74e20fadb",
      "train.csv": "9ea26585df5fe663c5a5cbcaf261a5e063d021d10b9a3795a672ea624c881815",
      "truth.json": "d412e2705d556b7e8196d02290d6f7d15678381353baae5dbd30935a96e33e7d"
    },
    "materialization_receipt_sha256": "d734721fa8f40b779c4fa297a5be4c0e5d1287b8836a8b1d56899f121137ef94",
    "selected_seed": 20260926,
    "system_inputs": [
      "train.csv",
      "test.csv"
    ],
    "test_records": 1614,
    "total_records": 2323,
    "train_records": 709,
    "truth_input_allowed": false,
    "truth_role": "evaluator-only",
    "truth_system_access": false
  },
  "current_effectuation_state": {
    "bridge_effectuation_authorized": false,
    "execution_runner_created": false,
    "execution_transaction_issued": false,
    "launcher_execution_authorized": false,
    "network_isolation_attestation_created": false,
    "process_launch_capability_present": false,
    "run_transaction_design_created": true,
    "subprocess_invocation": false
  },
  "execution_semantics": {
    "all_nine_runs_required": true,
    "configuration_may_depend_on_prior_run_output": false,
    "configuration_may_depend_on_quality_result": false,
    "configuration_may_depend_on_system_order": false,
    "continue_after_nonzero_exit": true,
    "failed_run_retention_required": true,
    "maximum_execution_batches": 1,
    "retry_within_transaction_allowed": false,
    "retuning_allowed": false,
    "runtime_mutation_allowed": false,
    "second_execution_requires_new_transaction": true
  },
  "family": 2,
  "future_executor_contract": {
    "executor_created": false,
    "module_path": "suites/entity-resolution-ambiguity-v1/execution_runner.py",
    "must_attempt_exactly_nine_runs": true,
    "must_consume_exact_bridge_transaction": true,
    "must_hash_raw_artifacts_before_scoring": true,
    "must_not_access_truth": true,
    "must_not_mutate_bridge": true,
    "must_not_mutate_controller": true,
    "must_not_mutate_launcher": true,
    "must_not_retry_failed_run": true,
    "must_not_retune": true,
    "must_retain_nonzero_exit_runs": true,
    "must_verify_all_upstream_hashes": true,
    "must_verify_corpus_hashes": true,
    "must_verify_network_isolation_attestation": true,
    "must_verify_raw_root_empty": true,
    "process_launch_capability_present": false
  },
  "issuance_gate": {
    "corpus_hash_audit_required": true,
    "execution_transaction_issued": false,
    "network_isolation_attestation_mainline_required": true,
    "raw_root_empty_audit_required": true,
    "runner_independent_review_required": true,
    "runner_mainline_required": true,
    "separate_explicit_operator_run_step_required": true,
    "transaction_currently_executable": false
  },
  "network_isolation_gate": {
    "execution_forbidden_without_attestation": true,
    "network_disabled_required": true,
    "network_isolation_attestation_created": false,
    "network_isolation_attestation_path": "protocols/entity-resolution-ambiguity-network-isolation-attestation-v1.json",
    "network_isolation_attestation_required": true,
    "network_isolation_mechanism_selected": false
  },
  "preexecution_state": {
    "activation_consumed": false,
    "permit_consumed": false,
    "quality_result_available": false,
    "raw_artifacts_produced": 0,
    "raw_execution_receipt_created": false,
    "raw_runs_produced": 0,
    "system_execution": false,
    "truth_scoring": false
  },
  "raw_evidence_contract": {
    "all_raw_runs_before_truth_scoring": true,
    "output_json_required": true,
    "raw_execution_receipt_created": false,
    "raw_execution_receipt_path": "evidence/entity-resolution-ambiguity-v1/raw-execution-receipt-v1.json",
    "raw_execution_receipt_required": true,
    "raw_output_retention_required": true,
    "raw_outputs_hash_bound_before_truth_reveal": true,
    "stderr_required": true,
    "stdout_required": true,
    "truth_scoring_locked_until_receipt_frozen": true
  },
  "root_contract": {
    "existing_raw_files_allowed": false,
    "partial_existing_transaction_allowed": false,
    "raw_root_may_not_contain_truth": true,
    "raw_root_must_be_empty_before_run": true,
    "raw_root_relative_path": "family-2-raw-runs"
  },
  "schema": "qvra-family-2-explicit-execution-run-transaction-design/v1",
  "scope": {
    "raw_artifacts_per_run": 3,
    "run_numbers": [
      1,
      2,
      3
    ],
    "runs_per_system": 3,
    "system_order": [
      "qvra-native-er-v1",
      "splink-4.0.17",
      "dedupe-3.0.3"
    ],
    "systems": [
      "qvra-native-er-v1",
      "splink-4.0.17",
      "dedupe-3.0.3"
    ],
    "total_required_raw_artifacts": 27,
    "total_required_raw_runs": 9
  },
  "transaction_kind": "exact-one-shot-nine-run-explicit-execution"
}
